{
  "manifest_version": "1",
  "id": "org.example.registry-r",
  "name": "Synthetic r module",
  "version": "1.0.0",
  "description": "Synthetic module for the Protocol §VII.3 registry fixtures.",
  "authors": [
    "UW Markdown contributors"
  ],
  "license": "MIT",
  "requires_protocol": "^4.0.0",
  "requires_format": "^3.0",
  "calculations": [
    {
      "id": "r_reads",
      "label": "r_reads",
      "formula": "shared_calc + 1",
      "deterministic": true
    }
  ],
  "requires_conformance": "verifier",
  "requires_profiles": [
    "module"
  ]
}
