{
  "manifest_version": "1",
  "id": "org.example.registry-a",
  "name": "Synthetic a module",
  "version": "1.0.0",
  "description": "Synthetic module for the Protocol §VII.3 registry fixtures.",
  "authors": [
    "UW Markdown contributors"
  ],
  "license": "MIT",
  "requires_protocol": "^4.0.0",
  "requires_format": "^3.0",
  "asset_classes": [
    "multifamily"
  ],
  "view_models": [
    {
      "section_id": "shared_section",
      "display_name": "A",
      "display_order": 30,
      "description": "A view of the shared section.",
      "primary_fields": []
    }
  ],
  "requires_conformance": "verifier"
}
