{
  "manifest_version": "1",
  "id": "org.example.registry-b",
  "name": "Synthetic b module",
  "version": "1.0.0",
  "description": "Synthetic module for the Protocol §VII.3 registry fixtures.",
  "authors": [
    "UW Markdown contributors"
  ],
  "license": "MIT",
  "requires_protocol": "^4.0.0",
  "requires_format": "^3.0",
  "depends_on": [
    {
      "id": "org.example.registry-a",
      "version": "^1.0.0"
    }
  ],
  "calculations": [
    {
      "id": "shared_calc",
      "label": "shared_calc",
      "formula": "shared_calc * 10",
      "deterministic": true
    }
  ],
  "requires_conformance": "verifier",
  "requires_profiles": [
    "module"
  ]
}
